{
  "entity_id": "chubb",
  "sub_factor": "trigger_gap",
  "rating_0_4": 3,
  "evidence_tier": "disclosed",
  "confidence": 0.82,
  "source_text": "Business Interruption cover responds following physical loss or damage to property used by the Insured at the Premises.",
  "sources": [
    "https://example.fixture/chubb-bi-wording-excerpt.pdf"
  ],
  "citation_ids": ["LMA-BI-GUIDE", "ACAD-BASIS-RISK-ARXIV"],
  "human_reviewed": true,
  "review_required": false
}
